{
  "errors": [],
  "machineValidated": true,
  "modelId": "column-subscription",
  "scenarioResults": [
    {
      "asOf": "2026-10-18T11:02:00Z",
      "errors": [],
      "evaluations": [
        {
          "passed": true,
          "result": "2026-10-01T09:00:00Z",
          "ruleRef": "rule.payment-start"
        },
        {
          "passed": true,
          "result": 9900,
          "ruleRef": "rule.payment-amount"
        },
        {
          "passed": true,
          "result": "2026-10-01T09:15:00Z",
          "ruleRef": "rule.payment-deadline"
        },
        {
          "passed": true,
          "result": "2026-10-01T09:07:00Z",
          "ruleRef": "rule.access-deadline"
        },
        {
          "passed": true,
          "result": "2026-10-23T10:01:00Z",
          "ruleRef": "rule.refund-deadline"
        },
        {
          "passed": true,
          "result": 9900,
          "ruleRef": "rule.refund-amount"
        },
        {
          "passed": true,
          "result": true,
          "ruleRef": "rule.access-completed"
        },
        {
          "passed": true,
          "result": false,
          "ruleRef": "rule.access-expired"
        },
        {
          "passed": true,
          "result": true,
          "ruleRef": "rule.refund-completed"
        },
        {
          "passed": true,
          "result": false,
          "ruleRef": "rule.refund-expired"
        },
        {
          "passed": true,
          "result": false,
          "ruleRef": "rule.content-readable"
        }
      ],
      "fulfillmentStatuses": [
        {
          "expectedStatus": "completed",
          "fulfillmentRef": "fulfillment.access",
          "passed": true,
          "requestInstanceRef": "instance.access-mobile",
          "status": "completed"
        },
        {
          "expectedStatus": "completed",
          "fulfillmentRef": "fulfillment.refund",
          "passed": true,
          "requestInstanceRef": "instance.refund",
          "status": "completed"
        }
      ],
      "instanceValues": [
        {
          "entityRef": "contract.subscription",
          "instanceRef": "instance.subscription",
          "values": {
            "access_seconds": 60,
            "amount_minor_units": 9900,
            "column_id": "COL-BM",
            "currency": "CNY",
            "edition_id": "ED-1",
            "payment_seconds": 900,
            "reader_id": "READER-001",
            "refund_seconds": 604800,
            "restore_seconds": 86400,
            "signed_at": "2026-10-01T09:00:00Z",
            "subscription_id": "SUB-20261001-001"
          }
        },
        {
          "entityRef": "contract.mobile",
          "instanceRef": "instance.mobile-agreement",
          "values": {
            "agreement_id": "MOBILE-001",
            "reader_id": "READER-001",
            "signed_at": "2026-10-01T08:00:00Z"
          }
        },
        {
          "entityRef": "request.payment",
          "instanceRef": "instance.payment",
          "values": {
            "amount_minor_units": 9900,
            "column_id": "COL-BM",
            "currency": "CNY",
            "expired_at": "2026-10-01T09:15:00Z",
            "reader_id": "READER-001",
            "request_id": "PAY-001",
            "started_at": "2026-10-01T09:00:00Z",
            "subscription_id": "SUB-20261001-001"
          }
        },
        {
          "entityRef": "request.mobile",
          "instanceRef": "instance.mobile-request",
          "values": {
            "agreement_id": "MOBILE-001",
            "amount_minor_units": 9900,
            "column_id": "COL-BM",
            "currency": "CNY",
            "expired_at": "2026-10-01T09:15:00Z",
            "payment_request_id": "PAY-001",
            "reader_id": "READER-001",
            "request_id": "MOBILE-REQ-001",
            "started_at": "2026-10-01T09:02:00Z",
            "subscription_id": "SUB-20261001-001"
          }
        },
        {
          "entityRef": "confirmation.mobile",
          "instanceRef": "instance.mobile-result",
          "values": {
            "amount_minor_units": 9900,
            "column_id": "COL-BM",
            "confirmed_at": "2026-10-01T09:05:00Z",
            "currency": "CNY",
            "payment_id": "MOBILE-TX-001",
            "payment_request_id": "PAY-001",
            "reader_id": "READER-001",
            "request_id": "MOBILE-REQ-001",
            "subscription_id": "SUB-20261001-001",
            "success": true
          }
        },
        {
          "entityRef": "request.access",
          "instanceRef": "instance.access-mobile",
          "values": {
            "chapter_id": "CH-01",
            "column_id": "COL-BM",
            "edition_id": "ED-1",
            "expired_at": "2026-10-01T09:07:00Z",
            "reader_id": "READER-001",
            "request_id": "ACCESS-MOBILE",
            "started_at": "2026-10-01T09:06:00Z",
            "subscription_id": "SUB-20261001-001"
          }
        },
        {
          "entityRef": "confirmation.access",
          "instanceRef": "instance.content-mobile",
          "values": {
            "chapter_id": "CH-01",
            "column_id": "COL-BM",
            "confirmed_at": "2026-10-01T09:06:02Z",
            "delivered": true,
            "edition_id": "ED-1",
            "reader_id": "READER-001",
            "request_id": "ACCESS-MOBILE",
            "subscription_id": "SUB-20261001-001"
          }
        },
        {
          "entityRef": "evidence.discontinuation",
          "instanceRef": "instance.discontinuation",
          "values": {
            "column_id": "COL-BM",
            "created_at": "2026-10-16T10:00:00Z",
            "delisted": true,
            "missed_due_at": "2026-10-08T10:00:00Z",
            "missing_content": true,
            "reader_id": "READER-001",
            "rescheduled": false,
            "subscription_id": "SUB-20261001-001"
          }
        },
        {
          "entityRef": "request.refund",
          "instanceRef": "instance.refund",
          "values": {
            "amount_minor_units": 9900,
            "column_id": "COL-BM",
            "currency": "CNY",
            "expired_at": "2026-10-23T10:01:00Z",
            "reader_id": "READER-001",
            "request_id": "REFUND-001",
            "started_at": "2026-10-16T10:01:00Z",
            "subscription_id": "SUB-20261001-001"
          }
        },
        {
          "entityRef": "confirmation.refund",
          "instanceRef": "instance.refunded",
          "values": {
            "amount_minor_units": 9900,
            "column_id": "COL-BM",
            "confirmed_at": "2026-10-18T10:00:00Z",
            "currency": "CNY",
            "reader_id": "READER-001",
            "receipt_id": "REFUND-RECEIPT-001",
            "request_id": "REFUND-001",
            "settled": true,
            "subscription_id": "SUB-20261001-001"
          }
        }
      ],
      "issuedInstanceRefs": [
        "instance.subscription",
        "instance.mobile-agreement",
        "instance.payment",
        "instance.mobile-request",
        "instance.mobile-result",
        "instance.access-mobile",
        "instance.content-mobile",
        "instance.discontinuation",
        "instance.refund",
        "instance.refunded"
      ],
      "machineValidated": true,
      "scenarioId": "scenario.access-after-refund",
      "simulationPassed": true
    },
    {
      "asOf": "2026-10-01T09:07:01Z",
      "errors": [],
      "evaluations": [
        {
          "passed": true,
          "result": "2026-10-01T09:00:00Z",
          "ruleRef": "rule.payment-start"
        },
        {
          "passed": true,
          "result": 9900,
          "ruleRef": "rule.payment-amount"
        },
        {
          "passed": true,
          "result": "2026-10-01T09:15:00Z",
          "ruleRef": "rule.payment-deadline"
        },
        {
          "passed": true,
          "result": "2026-10-01T09:07:00Z",
          "ruleRef": "rule.access-deadline"
        },
        {
          "passed": true,
          "result": false,
          "ruleRef": "rule.access-completed"
        },
        {
          "passed": true,
          "result": true,
          "ruleRef": "rule.access-expired"
        }
      ],
      "fulfillmentStatuses": [
        {
          "expectedStatus": "breached",
          "fulfillmentRef": "fulfillment.access",
          "passed": true,
          "requestInstanceRef": "instance.access-mobile",
          "status": "breached"
        }
      ],
      "instanceValues": [
        {
          "entityRef": "contract.subscription",
          "instanceRef": "instance.subscription",
          "values": {
            "access_seconds": 60,
            "amount_minor_units": 9900,
            "column_id": "COL-BM",
            "currency": "CNY",
            "edition_id": "ED-1",
            "payment_seconds": 900,
            "reader_id": "READER-001",
            "refund_seconds": 604800,
            "restore_seconds": 86400,
            "signed_at": "2026-10-01T09:00:00Z",
            "subscription_id": "SUB-20261001-001"
          }
        },
        {
          "entityRef": "contract.mobile",
          "instanceRef": "instance.mobile-agreement",
          "values": {
            "agreement_id": "MOBILE-001",
            "reader_id": "READER-001",
            "signed_at": "2026-10-01T08:00:00Z"
          }
        },
        {
          "entityRef": "request.payment",
          "instanceRef": "instance.payment",
          "values": {
            "amount_minor_units": 9900,
            "column_id": "COL-BM",
            "currency": "CNY",
            "expired_at": "2026-10-01T09:15:00Z",
            "reader_id": "READER-001",
            "request_id": "PAY-001",
            "started_at": "2026-10-01T09:00:00Z",
            "subscription_id": "SUB-20261001-001"
          }
        },
        {
          "entityRef": "request.mobile",